{
  "schema_version": "1.0.0",
  "status": "completed",
  "input": {
    "path": "D:\\HuaweiMoveData\\Users\\周宇晨\\Desktop\\Unfixed font version(2)\\data\\reports\\agent\\001309_2025-10-28.md",
    "sha256": "e6cb8ae6999c1b9188953e0fd37b295d5f6235344ce062ccee072e774b44504d"
  },
  "schemas": {
    "document_bundle": {
      "path": "D:\\HuaweiMoveData\\Users\\周宇晨\\Desktop\\Unfixed font version(2)\\schemas\\document_bundle.schema.json",
      "sha256": "d66e1e8c35c26934546718b3b111a40639e109b73f5450d58e786f7c338f82ae"
    },
    "slide_outline": {
      "path": "D:\\HuaweiMoveData\\Users\\周宇晨\\Desktop\\Unfixed font version(2)\\schemas\\slide_outline.schema.json",
      "sha256": "878e510b3299a4743bf00208474dcc89af7be7baea6ec4a99a79940028bee3d0"
    },
    "report_map": {
      "path": "D:\\HuaweiMoveData\\Users\\周宇晨\\Desktop\\Unfixed font version(2)\\schemas\\report_map.schema.json",
      "sha256": "a75bb868cd0130c4fcadfd5a4755674b4d6c90c30e0d7329ef415a1403d82f32"
    },
    "deck_storyboard": {
      "path": "D:\\HuaweiMoveData\\Users\\周宇晨\\Desktop\\Unfixed font version(2)\\schemas\\deck_storyboard.schema.json",
      "sha256": "f4b411cdb646875a8e60d0a745d819e762509fbee4b7772ae7f0f742d4f11fdd"
    },
    "visualization": {
      "path": "D:\\HuaweiMoveData\\Users\\周宇晨\\Desktop\\Unfixed font version(2)\\schemas\\visualization.schema.json",
      "sha256": "384eaedee6559976507d3e75f4151640b6f54ffb169814b48b2e1d90d809d6c4"
    },
    "visualization_manifest": {
      "path": "D:\\HuaweiMoveData\\Users\\周宇晨\\Desktop\\Unfixed font version(2)\\schemas\\visualization_manifest.schema.json",
      "sha256": "5e91136d99903517491f98fec2c8b6cf59270d088df4cb9cf6ecd62f830ba621"
    },
    "template_profile": {
      "path": "D:\\HuaweiMoveData\\Users\\周宇晨\\Desktop\\Unfixed font version(2)\\schemas\\template_profile.schema.json",
      "sha256": "9e84d4e3e17d8539b236c00c7ed902a9567daaf21590176eddbf0c2e48666734"
    },
    "compiled_layout_plan": {
      "path": "D:\\HuaweiMoveData\\Users\\周宇晨\\Desktop\\Unfixed font version(2)\\schemas\\compiled_layout_plan.schema.json",
      "sha256": "6d375f0b93fcc74e2f7ee50a50f19d147e1382b9b7e6c9884425ff2f36b957eb"
    },
    "run_manifest": {
      "path": "D:\\HuaweiMoveData\\Users\\周宇晨\\Desktop\\Unfixed font version(2)\\schemas\\run_manifest.schema.json",
      "sha256": "192203642957cdc4fe2a0b369258ea49ce1c05cd9788f21ab009f539a2f441ed"
    },
    "numeric_fact_ledger": {
      "path": "D:\\HuaweiMoveData\\Users\\周宇晨\\Desktop\\Unfixed font version(2)\\schemas\\numeric_fact_ledger.schema.json",
      "sha256": "aa98cd8a4e473488533bfea3e75ce271748610f0911ec7e854537b938dc9b51a"
    },
    "metric_group": {
      "path": "D:\\HuaweiMoveData\\Users\\周宇晨\\Desktop\\Unfixed font version(2)\\schemas\\metric_group.schema.json",
      "sha256": "b867abedf600889f5bf7f1f598d9a2d578f5a609f3906484db6b50b4afb9d12d"
    }
  },
  "hashes": {
    "outline_sha256": "af761387f36c36413be3d5a2ebc94928d936f3020cbaf2bcf54a19443f3952b3",
    "visualization_manifest_sha256": "972c6e90a88e20755b7893cabbe7e3b2c3155700cb92b64c59068e5af469c549",
    "template_profile_sha256": "33ea6b876e3689ebc88815a8cb67e5145522fd1afea7acc479462ed4fe5e0bfd",
    "template_sha256": "6890827410a2b25eb8b6cedd9fc345708e60a200b91329feb1d26cff75f2a5b2",
    "compiled_layout_plan_sha256": "00daa25b082d7c1ab73b50294aa23d50714fc4fbdf5ad66478cd9782edc464fd",
    "presentation_sha256": "6987d95bfefdca600353d4d511615dadab881f5a36afa1579de87fc59ca44ebe"
  },
  "template": {
    "profile_path": "D:\\HuaweiMoveData\\Users\\周宇晨\\Desktop\\Unfixed font version(2)\\output\\template_profile.json",
    "file_path": "D:\\HuaweiMoveData\\Users\\周宇晨\\Desktop\\Unfixed font version(2)\\templates\\financial_report_template_v1.pptx"
  },
  "warnings": {
    "visualization_count": 0,
    "file": "visualization_warnings.json"
  },
  "artifacts": [
    {
      "path": "document_bundle/document.json",
      "sha256": "d0172d0ce3ae19d9b217b226e13610327c48286f6f19d2e6bd52faab69db5c40"
    },
    {
      "path": "report_map.json",
      "sha256": "52f331a0caada268a69bf13981f403887f268903e4529449ac1b052f905486b0"
    },
    {
      "path": "deck_storyboard.json",
      "sha256": "35fb162ad29c06143bb04b7ba9d422ccd661afcab7335b7ec888ef1b03ee32db"
    },
    {
      "path": "slide_outline.json",
      "sha256": "0886da5fb741ff9fdbcb8ee6216694dd10470bcd2a0830803c6ae99a919151cd"
    },
    {
      "path": "numeric_fact_ledger.json",
      "sha256": "af6dd1b20b57d6629a1f5986d0fdd14d07c95ec22fe442533ad33f157d56bd29"
    },
    {
      "path": "metric_groups.json",
      "sha256": "215dd8239aa71085b2b694345dbb33a86c6ddfa04fc76ced869561dcf6d5dc89"
    },
    {
      "path": "numeric_audit.json",
      "sha256": "6ede71a7dd80b9db970f2901c11e6af288bd454754f26cbe0d8b0de04effd09f"
    },
    {
      "path": "visualization_warnings.json",
      "sha256": "d90fd58cfe46328587b92bb7ba6a5cfa21c88b1b9742ea6ab67f5c3528ee982c"
    },
    {
      "path": "template_profile.json",
      "sha256": "63394b231ed785fa0b264d33ea3209bd4531d574039bc500fd8be3dc1b3ddb30"
    },
    {
      "path": "visualizations/visualization_manifest.json",
      "sha256": "fef79b6bea17cc92d045fcd77932998feebebc118ad727e5deb0d7f9fe136b64"
    },
    {
      "path": "compiled_layout_plan.json",
      "sha256": "1ab5d91c1531cde006ae8e50af9faed64cd9711f4178bc6e3fc2299be9612e81"
    },
    {
      "path": "presentation.pptx",
      "sha256": "6987d95bfefdca600353d4d511615dadab881f5a36afa1579de87fc59ca44ebe"
    }
  ]
}
