{
  "schema_version": "1.0.0",
  "status": "completed",
  "input": {
    "path": "D:\\HuaweiMoveData\\Users\\周宇晨\\Desktop\\Unfixed font version(2)\\data\\reports\\agent\\002821_2025-09-11.md",
    "sha256": "8aa38380f3c647412e938fbb4daf72fb83fe406aca078a803b0486c66a8eb493"
  },
  "schemas": {
    "document_bundle": {
      "path": "D:\\HuaweiMoveData\\Users\\周宇晨\\Desktop\\Unfixed font version(2)\\schemas\\document_bundle.schema.json",
      "sha256": "d66e1e8c35c26934546718b3b111a40639e109b73f5450d58e786f7c338f82ae"
    },
    "slide_outline": {
      "path": "D:\\HuaweiMoveData\\Users\\周宇晨\\Desktop\\Unfixed font version(2)\\schemas\\slide_outline.schema.json",
      "sha256": "878e510b3299a4743bf00208474dcc89af7be7baea6ec4a99a79940028bee3d0"
    },
    "report_map": {
      "path": "D:\\HuaweiMoveData\\Users\\周宇晨\\Desktop\\Unfixed font version(2)\\schemas\\report_map.schema.json",
      "sha256": "a75bb868cd0130c4fcadfd5a4755674b4d6c90c30e0d7329ef415a1403d82f32"
    },
    "deck_storyboard": {
      "path": "D:\\HuaweiMoveData\\Users\\周宇晨\\Desktop\\Unfixed font version(2)\\schemas\\deck_storyboard.schema.json",
      "sha256": "f4b411cdb646875a8e60d0a745d819e762509fbee4b7772ae7f0f742d4f11fdd"
    },
    "visualization": {
      "path": "D:\\HuaweiMoveData\\Users\\周宇晨\\Desktop\\Unfixed font version(2)\\schemas\\visualization.schema.json",
      "sha256": "384eaedee6559976507d3e75f4151640b6f54ffb169814b48b2e1d90d809d6c4"
    },
    "visualization_manifest": {
      "path": "D:\\HuaweiMoveData\\Users\\周宇晨\\Desktop\\Unfixed font version(2)\\schemas\\visualization_manifest.schema.json",
      "sha256": "5e91136d99903517491f98fec2c8b6cf59270d088df4cb9cf6ecd62f830ba621"
    },
    "template_profile": {
      "path": "D:\\HuaweiMoveData\\Users\\周宇晨\\Desktop\\Unfixed font version(2)\\schemas\\template_profile.schema.json",
      "sha256": "9e84d4e3e17d8539b236c00c7ed902a9567daaf21590176eddbf0c2e48666734"
    },
    "compiled_layout_plan": {
      "path": "D:\\HuaweiMoveData\\Users\\周宇晨\\Desktop\\Unfixed font version(2)\\schemas\\compiled_layout_plan.schema.json",
      "sha256": "6d375f0b93fcc74e2f7ee50a50f19d147e1382b9b7e6c9884425ff2f36b957eb"
    },
    "run_manifest": {
      "path": "D:\\HuaweiMoveData\\Users\\周宇晨\\Desktop\\Unfixed font version(2)\\schemas\\run_manifest.schema.json",
      "sha256": "192203642957cdc4fe2a0b369258ea49ce1c05cd9788f21ab009f539a2f441ed"
    },
    "numeric_fact_ledger": {
      "path": "D:\\HuaweiMoveData\\Users\\周宇晨\\Desktop\\Unfixed font version(2)\\schemas\\numeric_fact_ledger.schema.json",
      "sha256": "aa98cd8a4e473488533bfea3e75ce271748610f0911ec7e854537b938dc9b51a"
    },
    "metric_group": {
      "path": "D:\\HuaweiMoveData\\Users\\周宇晨\\Desktop\\Unfixed font version(2)\\schemas\\metric_group.schema.json",
      "sha256": "b867abedf600889f5bf7f1f598d9a2d578f5a609f3906484db6b50b4afb9d12d"
    }
  },
  "hashes": {
    "outline_sha256": "0a19f3564f7b5b7834d5bbf77319f366e0ffd4cc4537955d4659f52930d31c04",
    "visualization_manifest_sha256": "3833cc804cc48e778189044f2332d9e8240eef659c32b061342b683777337513",
    "template_profile_sha256": "33ea6b876e3689ebc88815a8cb67e5145522fd1afea7acc479462ed4fe5e0bfd",
    "template_sha256": "6890827410a2b25eb8b6cedd9fc345708e60a200b91329feb1d26cff75f2a5b2",
    "compiled_layout_plan_sha256": "7b021dd139fe554a682925da8dd6a6f42b721772ca4acc98d2d249a16b559704",
    "presentation_sha256": "b0256aace20f9aef43d953d6d0af66f62e5e723e0639bc2ede0e822f98c1533c"
  },
  "template": {
    "profile_path": "D:\\HuaweiMoveData\\Users\\周宇晨\\Desktop\\Unfixed font version(2)\\output\\template_profile.json",
    "file_path": "D:\\HuaweiMoveData\\Users\\周宇晨\\Desktop\\Unfixed font version(2)\\templates\\financial_report_template_v1.pptx"
  },
  "warnings": {
    "visualization_count": 7,
    "file": "visualization_warnings.json"
  },
  "artifacts": [
    {
      "path": "document_bundle/document.json",
      "sha256": "c8251a0a2c31ef3bf1fc1c3f3cd3f70d676823bd3cda2ecd60b5c42c705a8975"
    },
    {
      "path": "report_map.json",
      "sha256": "2cb064b14e17c5f4028f352d68353cd7faad1af7ddcd170505670c019bea2ac8"
    },
    {
      "path": "deck_storyboard.json",
      "sha256": "9300c27c4f0d4eaa8ee6f989123aeb787732534cedad893f019a49c969fd512d"
    },
    {
      "path": "slide_outline.json",
      "sha256": "f2884506a97d19eaf806d290255cc35d2f0eed915d4155481bdb6f369ae84b87"
    },
    {
      "path": "numeric_fact_ledger.json",
      "sha256": "4927774f6fc72d2dc39fc0e0fddd5d7276db695dcfd87192e8b91a81c93fb2c1"
    },
    {
      "path": "metric_groups.json",
      "sha256": "215dd8239aa71085b2b694345dbb33a86c6ddfa04fc76ced869561dcf6d5dc89"
    },
    {
      "path": "numeric_audit.json",
      "sha256": "14c929eaf17f9efdaf8a74426b3c3a5525148b9ffdc0094b3b4f863855abcbcd"
    },
    {
      "path": "visualization_warnings.json",
      "sha256": "9f43ce09a0715b81b2bfdbd064b2a581689cca7d51b033b29e1c18bd5a180c56"
    },
    {
      "path": "template_profile.json",
      "sha256": "63394b231ed785fa0b264d33ea3209bd4531d574039bc500fd8be3dc1b3ddb30"
    },
    {
      "path": "visualizations/visualization_manifest.json",
      "sha256": "4eab2ef8183f8d71f6f7923a44cea4c28ec6922a7cd07183b0ee4e1c07c0b390"
    },
    {
      "path": "visualizations/slide_017__visual_008.json",
      "sha256": "8a7b31ee5e1895cc2a031c1fca3f618a96e047f6ad936e1714a923bca119400d"
    },
    {
      "path": "compiled_layout_plan.json",
      "sha256": "e02414503346191aed4d60f20d99213daff60affbfaa26df160217e2b857418f"
    },
    {
      "path": "presentation.pptx",
      "sha256": "b0256aace20f9aef43d953d6d0af66f62e5e723e0639bc2ede0e822f98c1533c"
    }
  ]
}
