{
  "schema_version": "1.0.0",
  "status": "completed",
  "input": {
    "path": "D:\\HuaweiMoveData\\Users\\周宇晨\\Desktop\\Unfixed font version(2)\\data\\reports\\agent\\002821_2025-09-11.md",
    "sha256": "8aa38380f3c647412e938fbb4daf72fb83fe406aca078a803b0486c66a8eb493"
  },
  "schemas": {
    "document_bundle": {
      "path": "D:\\HuaweiMoveData\\Users\\周宇晨\\Desktop\\Unfixed font version(2)\\schemas\\document_bundle.schema.json",
      "sha256": "d66e1e8c35c26934546718b3b111a40639e109b73f5450d58e786f7c338f82ae"
    },
    "slide_outline": {
      "path": "D:\\HuaweiMoveData\\Users\\周宇晨\\Desktop\\Unfixed font version(2)\\schemas\\slide_outline.schema.json",
      "sha256": "5ad5eb67aadc2d80af5dde0dd142333e47c718f96ef0ea40dc16cf89872e4752"
    },
    "visualization": {
      "path": "D:\\HuaweiMoveData\\Users\\周宇晨\\Desktop\\Unfixed font version(2)\\schemas\\visualization.schema.json",
      "sha256": "384eaedee6559976507d3e75f4151640b6f54ffb169814b48b2e1d90d809d6c4"
    },
    "visualization_manifest": {
      "path": "D:\\HuaweiMoveData\\Users\\周宇晨\\Desktop\\Unfixed font version(2)\\schemas\\visualization_manifest.schema.json",
      "sha256": "5e91136d99903517491f98fec2c8b6cf59270d088df4cb9cf6ecd62f830ba621"
    },
    "template_profile": {
      "path": "D:\\HuaweiMoveData\\Users\\周宇晨\\Desktop\\Unfixed font version(2)\\schemas\\template_profile.schema.json",
      "sha256": "9e84d4e3e17d8539b236c00c7ed902a9567daaf21590176eddbf0c2e48666734"
    },
    "compiled_layout_plan": {
      "path": "D:\\HuaweiMoveData\\Users\\周宇晨\\Desktop\\Unfixed font version(2)\\schemas\\compiled_layout_plan.schema.json",
      "sha256": "6d375f0b93fcc74e2f7ee50a50f19d147e1382b9b7e6c9884425ff2f36b957eb"
    },
    "run_manifest": {
      "path": "D:\\HuaweiMoveData\\Users\\周宇晨\\Desktop\\Unfixed font version(2)\\schemas\\run_manifest.schema.json",
      "sha256": "192203642957cdc4fe2a0b369258ea49ce1c05cd9788f21ab009f539a2f441ed"
    },
    "numeric_fact_ledger": {
      "path": "D:\\HuaweiMoveData\\Users\\周宇晨\\Desktop\\Unfixed font version(2)\\schemas\\numeric_fact_ledger.schema.json",
      "sha256": "aa98cd8a4e473488533bfea3e75ce271748610f0911ec7e854537b938dc9b51a"
    },
    "metric_group": {
      "path": "D:\\HuaweiMoveData\\Users\\周宇晨\\Desktop\\Unfixed font version(2)\\schemas\\metric_group.schema.json",
      "sha256": "b867abedf600889f5bf7f1f598d9a2d578f5a609f3906484db6b50b4afb9d12d"
    }
  },
  "hashes": {
    "outline_sha256": "eca5d44d16bd612cea4452a06f9ac3b01d17e8d23cd480af42f36b26038f7e34",
    "visualization_manifest_sha256": "7f682820648e7715e8dc1e577c985684c0be04796aafcbb4045accd92930e642",
    "template_profile_sha256": "33ea6b876e3689ebc88815a8cb67e5145522fd1afea7acc479462ed4fe5e0bfd",
    "template_sha256": "6890827410a2b25eb8b6cedd9fc345708e60a200b91329feb1d26cff75f2a5b2",
    "compiled_layout_plan_sha256": "e15ae8c4047681eed2d0769d195994ad749b112c5c275dc38b7cb6b3904ae80c",
    "presentation_sha256": "1ae8fc8ce16a36c211474494d184e46f2ada387c996b7e211a32bf06b87e355a"
  },
  "template": {
    "profile_path": "D:\\HuaweiMoveData\\Users\\周宇晨\\Desktop\\Unfixed font version(2)\\output\\template_profile.json",
    "file_path": "D:\\HuaweiMoveData\\Users\\周宇晨\\Desktop\\Unfixed font version(2)\\templates\\financial_report_template_v1.pptx"
  },
  "warnings": {
    "visualization_count": 0,
    "file": "visualization_warnings.json"
  },
  "artifacts": [
    {
      "path": "document_bundle/document.json",
      "sha256": "c8251a0a2c31ef3bf1fc1c3f3cd3f70d676823bd3cda2ecd60b5c42c705a8975"
    },
    {
      "path": "slide_outline.json",
      "sha256": "70e3621be123d1dcbc1ac2be5744b3558f57b92a86bee75bfd9a1ddeff9b699c"
    },
    {
      "path": "numeric_fact_ledger.json",
      "sha256": "4927774f6fc72d2dc39fc0e0fddd5d7276db695dcfd87192e8b91a81c93fb2c1"
    },
    {
      "path": "metric_groups.json",
      "sha256": "215dd8239aa71085b2b694345dbb33a86c6ddfa04fc76ced869561dcf6d5dc89"
    },
    {
      "path": "numeric_audit.json",
      "sha256": "35e05268e32b7c6e2333b0135c57513c1151caa5527768558d15e3a4ec159f41"
    },
    {
      "path": "visualization_warnings.json",
      "sha256": "d90fd58cfe46328587b92bb7ba6a5cfa21c88b1b9742ea6ab67f5c3528ee982c"
    },
    {
      "path": "template_profile.json",
      "sha256": "63394b231ed785fa0b264d33ea3209bd4531d574039bc500fd8be3dc1b3ddb30"
    },
    {
      "path": "visualizations/visualization_manifest.json",
      "sha256": "20eff0e26fcb24ba6e2eced901e62867560fbd2e231ea29d5c80b1280c5fed2b"
    },
    {
      "path": "visualizations/slide_003__visual_001.json",
      "sha256": "1fb67f99b4d399e8f52e7c53ac5ea9c6b837b6c897b1a76ab664fce1fc7a3552"
    },
    {
      "path": "visualizations/slide_003__visual_002.json",
      "sha256": "4d5d5e8030d2eab305829c55c42ebb7c56826c357aef35af1dee65f087b844dc"
    },
    {
      "path": "visualizations/slide_005__visual_003.json",
      "sha256": "57d1d7a0a30db22e8814d033c218c1d3706ea5a7fcd4b342306cd15711b30ce2"
    },
    {
      "path": "visualizations/slide_011__visual_004.json",
      "sha256": "93ecc4b0dca7cad34c1017cec3c6e950ddac8ced118f35d5aefe4d3adb5b0aac"
    },
    {
      "path": "visualizations/slide_011__visual_005.json",
      "sha256": "3ab7ee50e6db0a797e9e1ee2e0e63b1b48b61914e743b2900c627b856abce938"
    },
    {
      "path": "compiled_layout_plan.json",
      "sha256": "c93f63cb405728513573ce3ef74b44718cc3947f87a2c55eb6488af1c86a6019"
    },
    {
      "path": "presentation.pptx",
      "sha256": "1ae8fc8ce16a36c211474494d184e46f2ada387c996b7e211a32bf06b87e355a"
    }
  ]
}
