{
  "schema_version": "1.0.0",
  "status": "completed",
  "input": {
    "path": "D:\\HuaweiMoveData\\Users\\周宇晨\\Desktop\\Unfixed font version(2)\\data\\reports\\agent\\002544_2025-10-28.md",
    "sha256": "856461c2f536592cd1760c64bc08329a2c4086f149e70cf2f579e78e97e90621"
  },
  "schemas": {
    "document_bundle": {
      "path": "D:\\HuaweiMoveData\\Users\\周宇晨\\Desktop\\Unfixed font version(2)\\schemas\\document_bundle.schema.json",
      "sha256": "d66e1e8c35c26934546718b3b111a40639e109b73f5450d58e786f7c338f82ae"
    },
    "slide_outline": {
      "path": "D:\\HuaweiMoveData\\Users\\周宇晨\\Desktop\\Unfixed font version(2)\\schemas\\slide_outline.schema.json",
      "sha256": "878e510b3299a4743bf00208474dcc89af7be7baea6ec4a99a79940028bee3d0"
    },
    "report_map": {
      "path": "D:\\HuaweiMoveData\\Users\\周宇晨\\Desktop\\Unfixed font version(2)\\schemas\\report_map.schema.json",
      "sha256": "a75bb868cd0130c4fcadfd5a4755674b4d6c90c30e0d7329ef415a1403d82f32"
    },
    "deck_storyboard": {
      "path": "D:\\HuaweiMoveData\\Users\\周宇晨\\Desktop\\Unfixed font version(2)\\schemas\\deck_storyboard.schema.json",
      "sha256": "f4b411cdb646875a8e60d0a745d819e762509fbee4b7772ae7f0f742d4f11fdd"
    },
    "visualization": {
      "path": "D:\\HuaweiMoveData\\Users\\周宇晨\\Desktop\\Unfixed font version(2)\\schemas\\visualization.schema.json",
      "sha256": "384eaedee6559976507d3e75f4151640b6f54ffb169814b48b2e1d90d809d6c4"
    },
    "visualization_manifest": {
      "path": "D:\\HuaweiMoveData\\Users\\周宇晨\\Desktop\\Unfixed font version(2)\\schemas\\visualization_manifest.schema.json",
      "sha256": "5e91136d99903517491f98fec2c8b6cf59270d088df4cb9cf6ecd62f830ba621"
    },
    "template_profile": {
      "path": "D:\\HuaweiMoveData\\Users\\周宇晨\\Desktop\\Unfixed font version(2)\\schemas\\template_profile.schema.json",
      "sha256": "9e84d4e3e17d8539b236c00c7ed902a9567daaf21590176eddbf0c2e48666734"
    },
    "compiled_layout_plan": {
      "path": "D:\\HuaweiMoveData\\Users\\周宇晨\\Desktop\\Unfixed font version(2)\\schemas\\compiled_layout_plan.schema.json",
      "sha256": "6d375f0b93fcc74e2f7ee50a50f19d147e1382b9b7e6c9884425ff2f36b957eb"
    },
    "run_manifest": {
      "path": "D:\\HuaweiMoveData\\Users\\周宇晨\\Desktop\\Unfixed font version(2)\\schemas\\run_manifest.schema.json",
      "sha256": "192203642957cdc4fe2a0b369258ea49ce1c05cd9788f21ab009f539a2f441ed"
    },
    "numeric_fact_ledger": {
      "path": "D:\\HuaweiMoveData\\Users\\周宇晨\\Desktop\\Unfixed font version(2)\\schemas\\numeric_fact_ledger.schema.json",
      "sha256": "aa98cd8a4e473488533bfea3e75ce271748610f0911ec7e854537b938dc9b51a"
    },
    "metric_group": {
      "path": "D:\\HuaweiMoveData\\Users\\周宇晨\\Desktop\\Unfixed font version(2)\\schemas\\metric_group.schema.json",
      "sha256": "b867abedf600889f5bf7f1f598d9a2d578f5a609f3906484db6b50b4afb9d12d"
    }
  },
  "hashes": {
    "outline_sha256": "35cbac576f952578a2fbe41e90399a79749191d8a2c2994cdffa4d4154461031",
    "visualization_manifest_sha256": "f113a33e238a0e84c92f673b1bd063451078c56c5854b4b5e0d4676655d2b047",
    "template_profile_sha256": "33ea6b876e3689ebc88815a8cb67e5145522fd1afea7acc479462ed4fe5e0bfd",
    "template_sha256": "6890827410a2b25eb8b6cedd9fc345708e60a200b91329feb1d26cff75f2a5b2",
    "compiled_layout_plan_sha256": "1e3df24a7dd448091aadfafaeee6d14b7aacfc58d42514ebd101482e50bd58f1",
    "presentation_sha256": "e406d60cb042e598cdbbac0f51f6a3cacb6bf314012103f8bb26d6ceed8badca"
  },
  "template": {
    "profile_path": "D:\\HuaweiMoveData\\Users\\周宇晨\\Desktop\\Unfixed font version(2)\\output\\template_profile.json",
    "file_path": "D:\\HuaweiMoveData\\Users\\周宇晨\\Desktop\\Unfixed font version(2)\\templates\\financial_report_template_v1.pptx"
  },
  "warnings": {
    "visualization_count": 2,
    "file": "visualization_warnings.json"
  },
  "artifacts": [
    {
      "path": "document_bundle/document.json",
      "sha256": "3d4536c8579ffc7504f8ad4bcf4479e733745921dd5a96dd147ec9a9fb7b608c"
    },
    {
      "path": "report_map.json",
      "sha256": "cc2dc01770d360b7dd089f6dec490ccb821026050cb7ce0a8f8f29f5353ac9df"
    },
    {
      "path": "deck_storyboard.json",
      "sha256": "0018fdbd9215ae76d089e72760f914623739f4500380d46a6ab4a97cd36fc991"
    },
    {
      "path": "slide_outline.json",
      "sha256": "12f4deeaece46a691d01c821785481aff7ff985e394fb9827a99f87d9bba3971"
    },
    {
      "path": "numeric_fact_ledger.json",
      "sha256": "a248386dd7e9c9af216a14e57ec301903064951c40a7b3e91e3046faecabdc7e"
    },
    {
      "path": "metric_groups.json",
      "sha256": "215dd8239aa71085b2b694345dbb33a86c6ddfa04fc76ced869561dcf6d5dc89"
    },
    {
      "path": "numeric_audit.json",
      "sha256": "5d3cc7bba815ad636276aa20c31b8df9ff0912a90735dd7c6914cc39408616ba"
    },
    {
      "path": "visualization_warnings.json",
      "sha256": "5083ecc7e04709804159cab11dd627d2c0aa447d2f5fd9729099822f9585088e"
    },
    {
      "path": "template_profile.json",
      "sha256": "63394b231ed785fa0b264d33ea3209bd4531d574039bc500fd8be3dc1b3ddb30"
    },
    {
      "path": "visualizations/visualization_manifest.json",
      "sha256": "efe89f6a45174e73cbfc21ae91dbd2d4ecd35420fe2759884875c81a4502347d"
    },
    {
      "path": "visualizations/slide_004__visual_table-001.json",
      "sha256": "836c655f8669102aa95d396ffed10e42e85b5295a9707453e91cd9dd59975f90"
    },
    {
      "path": "visualizations/slide_012__visual_table-002.json",
      "sha256": "4688c03a1d5c5af43a4799dc31adc47d7f6781576cafd16b9c776dd621da5f15"
    },
    {
      "path": "visualizations/slide_014__visual_table-004.json",
      "sha256": "ae150733df955d69a4367bc482ba9c864277a6844b79ceac2f0f06f7b2332b58"
    },
    {
      "path": "visualizations/slide_015__visual_table-007.json",
      "sha256": "efce1d3d3cc2e31fcf76f697d02e5db06fc02998a5038a44b965f3b5cbe96f1c"
    },
    {
      "path": "visualizations/slide_017__visual_table-008.json",
      "sha256": "ecd7398b1bcf4bfbe9ae4a10f0e3da441762f357662a4cd8527d905501ef6447"
    },
    {
      "path": "compiled_layout_plan.json",
      "sha256": "2a1c43dfc4c13a5eb3fe202a6eaf7aa5a0a37d2986e19d13a7ee7b06f107bdfe"
    },
    {
      "path": "presentation.pptx",
      "sha256": "e406d60cb042e598cdbbac0f51f6a3cacb6bf314012103f8bb26d6ceed8badca"
    }
  ]
}
