{
  "schema_version": "1.0.0",
  "status": "completed",
  "input": {
    "path": "D:\\HuaweiMoveData\\Users\\周宇晨\\Desktop\\Unfixed font version(2)\\data\\reports\\agent\\002444_2025-09-21.md",
    "sha256": "68c1e5dac675aa57573df1b1126f453ace69530f65e9007bf0364f6414eec772"
  },
  "schemas": {
    "document_bundle": {
      "path": "D:\\HuaweiMoveData\\Users\\周宇晨\\Desktop\\Unfixed font version(2)\\schemas\\document_bundle.schema.json",
      "sha256": "d66e1e8c35c26934546718b3b111a40639e109b73f5450d58e786f7c338f82ae"
    },
    "slide_outline": {
      "path": "D:\\HuaweiMoveData\\Users\\周宇晨\\Desktop\\Unfixed font version(2)\\schemas\\slide_outline.schema.json",
      "sha256": "5ad5eb67aadc2d80af5dde0dd142333e47c718f96ef0ea40dc16cf89872e4752"
    },
    "visualization": {
      "path": "D:\\HuaweiMoveData\\Users\\周宇晨\\Desktop\\Unfixed font version(2)\\schemas\\visualization.schema.json",
      "sha256": "384eaedee6559976507d3e75f4151640b6f54ffb169814b48b2e1d90d809d6c4"
    },
    "visualization_manifest": {
      "path": "D:\\HuaweiMoveData\\Users\\周宇晨\\Desktop\\Unfixed font version(2)\\schemas\\visualization_manifest.schema.json",
      "sha256": "5e91136d99903517491f98fec2c8b6cf59270d088df4cb9cf6ecd62f830ba621"
    },
    "template_profile": {
      "path": "D:\\HuaweiMoveData\\Users\\周宇晨\\Desktop\\Unfixed font version(2)\\schemas\\template_profile.schema.json",
      "sha256": "9e84d4e3e17d8539b236c00c7ed902a9567daaf21590176eddbf0c2e48666734"
    },
    "compiled_layout_plan": {
      "path": "D:\\HuaweiMoveData\\Users\\周宇晨\\Desktop\\Unfixed font version(2)\\schemas\\compiled_layout_plan.schema.json",
      "sha256": "6d375f0b93fcc74e2f7ee50a50f19d147e1382b9b7e6c9884425ff2f36b957eb"
    },
    "run_manifest": {
      "path": "D:\\HuaweiMoveData\\Users\\周宇晨\\Desktop\\Unfixed font version(2)\\schemas\\run_manifest.schema.json",
      "sha256": "192203642957cdc4fe2a0b369258ea49ce1c05cd9788f21ab009f539a2f441ed"
    },
    "numeric_fact_ledger": {
      "path": "D:\\HuaweiMoveData\\Users\\周宇晨\\Desktop\\Unfixed font version(2)\\schemas\\numeric_fact_ledger.schema.json",
      "sha256": "aa98cd8a4e473488533bfea3e75ce271748610f0911ec7e854537b938dc9b51a"
    },
    "metric_group": {
      "path": "D:\\HuaweiMoveData\\Users\\周宇晨\\Desktop\\Unfixed font version(2)\\schemas\\metric_group.schema.json",
      "sha256": "b867abedf600889f5bf7f1f598d9a2d578f5a609f3906484db6b50b4afb9d12d"
    }
  },
  "hashes": {
    "outline_sha256": "8e914cfbc5f32b51a1aec0bf496a6b4a50276ebacd076b0455908203c76bb0bc",
    "visualization_manifest_sha256": "f4fd50223a4e8ca355c654b28bb02967ccfae0a2139a8ad935ae4494a2edc774",
    "template_profile_sha256": "33ea6b876e3689ebc88815a8cb67e5145522fd1afea7acc479462ed4fe5e0bfd",
    "template_sha256": "6890827410a2b25eb8b6cedd9fc345708e60a200b91329feb1d26cff75f2a5b2",
    "compiled_layout_plan_sha256": "29a6a99cc5d368d25d99d6009e1e339a7ced939b7938c25221b8595246c725e3",
    "presentation_sha256": "6fc389525fc73b3728f52ab368e76adf24d7a3da944b7b5a2b87ad0d2240e4f8"
  },
  "template": {
    "profile_path": "D:\\HuaweiMoveData\\Users\\周宇晨\\Desktop\\Unfixed font version(2)\\output\\template_profile.json",
    "file_path": "D:\\HuaweiMoveData\\Users\\周宇晨\\Desktop\\Unfixed font version(2)\\templates\\financial_report_template_v1.pptx"
  },
  "warnings": {
    "visualization_count": 24,
    "file": "visualization_warnings.json"
  },
  "artifacts": [
    {
      "path": "document_bundle/document.json",
      "sha256": "768847a7e712e1b8095b6140ac805a4ce0ed4aadd70498e50e2682859553fd9d"
    },
    {
      "path": "slide_outline.json",
      "sha256": "d5324aee1c020e6fda5e67c924670f91d4b51b4e8383b2d03905508b489ccf16"
    },
    {
      "path": "numeric_fact_ledger.json",
      "sha256": "e2a6011e7107d66397ed55f2a3a17b6d59999b2f0b6e46699f3f9fc4c03b1d1d"
    },
    {
      "path": "metric_groups.json",
      "sha256": "9a89f64f29fb7b6c835174d79dcc950cae31852e7aec621a1eeb002f39b804ef"
    },
    {
      "path": "numeric_audit.json",
      "sha256": "4338711ee48fdd48292b4a14eb981422bc13181e03c756994f321aa646406c70"
    },
    {
      "path": "visualization_warnings.json",
      "sha256": "a5b1143c4dbb094f99485c63663a48e472f5f08e4b1efe254bd25f5b9b19dfa9"
    },
    {
      "path": "template_profile.json",
      "sha256": "63394b231ed785fa0b264d33ea3209bd4531d574039bc500fd8be3dc1b3ddb30"
    },
    {
      "path": "visualizations/visualization_manifest.json",
      "sha256": "40083cdf131258d5438cc266534770e474f7ea2b92ace2860b5a3efc77b7b19a"
    },
    {
      "path": "visualizations/slide_004__visual_002.json",
      "sha256": "2c2f295f11801e806c5f7a1e644a0d1a5e0c334b11b6c9be8c89c1fe3c7788be"
    },
    {
      "path": "visualizations/slide_019__visual_024.json",
      "sha256": "690a7f20105110a3fc4d31c652e22f46e3b2f604d40ed6a2c05c8984b3ecd71b"
    },
    {
      "path": "visualizations/slide_021__visual_027.json",
      "sha256": "958b3aeeaab42a0d0ba1e571ef12fa28a7b73226f1a5f98ee36226cc4c7d788a"
    },
    {
      "path": "visualizations/slide_022__visual_028.json",
      "sha256": "7d52ccebcec6f1ce166cd1d0ed0aff23eadb7054c66b62e3cc9f781889a4a185"
    },
    {
      "path": "visualizations/slide_022__visual_029.json",
      "sha256": "8aa55927f7fc7cad23e037bebb53f7a4f4e5ccd7edb6a5140166132ce23c1d22"
    },
    {
      "path": "compiled_layout_plan.json",
      "sha256": "7f9d7f80ef8b9b5cd4a2ad69a4d188ac2c4b2c585d35240f2e891c4151c33c24"
    },
    {
      "path": "presentation.pptx",
      "sha256": "6fc389525fc73b3728f52ab368e76adf24d7a3da944b7b5a2b87ad0d2240e4f8"
    }
  ]
}
